[
  {
    "id": "2026-07-30-website-launch",
    "date": "2026-07-30",
    "category": "business",
    "title": "Leo Forge digital headquarters launched",
    "summary": "LeoForgeStudios.com went live and contact@leoforgestudios.com became the official contact address.",
    "relatedProjectId": "",
    "repositoryUrl": "",
    "commitUrl": "",
    "public": true,
    "updatedAt": "2026-08-01"
  },
  {
    "id": "2026-07-30-formation-filed",
    "date": "2026-07-30",
    "category": "business",
    "title": "Leo Forge Studios LLC formation filed",
    "summary": "The Georgia business formation filing for Leo Forge Studios LLC was submitted for review.",
    "relatedProjectId": "",
    "repositoryUrl": "",
    "commitUrl": "",
    "public": true,
    "updatedAt": "2026-08-01"
  }
]
